{
  "$schema": "https://json-schema.org/draft/2020-12/schema",
  "additionalProperties": true,
  "properties": {
    "commands": {
      "type": "array"
    },
    "created_at": {
      "type": "string"
    },
    "id": {
      "type": "string"
    },
    "packet": {
      "type": "string"
    },
    "related_findings": {
      "type": "array"
    },
    "scope_check": {
      "type": "object"
    },
    "status": {
      "type": "string"
    }
  },
  "required": [
    "id",
    "status",
    "commands",
    "created_at"
  ],
  "schema_version": "1.0",
  "title": "validation",
  "type": "object"
}
